{
  "$schema": "https://json-schema.org/draft/2020-12/schema",
  "$id": "https://unified-quant.local/schemas/contracts/paper_portfolio_state.v1.json.json",
  "title": "Paper Portfolio State",
  "type": "object",
  "additionalProperties": false,
  "required": [
    "contract_version",
    "schema_version",
    "execution_id",
    "state_date",
    "state_mode",
    "cash",
    "data_file",
    "data_checksum_sha256",
    "columns",
    "dtypes",
    "row_count",
    "key_uniqueness",
    "logical_fingerprint",
    "serialization_profile_id",
    "target_weights_binding",
    "previous_state_binding",
    "execution_result_binding",
    "risk_decision_binding",
    "market_data_binding",
    "run_id",
    "created_at",
    "quality_report_checksum_sha256",
    "manifest_digest_sha256",
    "generation_id"
  ],
  "properties": {
    "contract_version": {
      "const": 1
    },
    "schema_version": {
      "const": "1.0.0"
    },
    "execution_id": {
      "type": "string",
      "pattern": "^[A-Za-z0-9][A-Za-z0-9._-]{0,127}$",
      "not": {
        "enum": [
          ".",
          ".."
        ]
      }
    },
    "state_date": {
      "$ref": "#/$defs/date"
    },
    "state_mode": {
      "enum": [
        "initial",
        "continuation"
      ]
    },
    "cash": {
      "type": "number",
      "minimum": 0
    },
    "data_file": {
      "type": "string",
      "pattern": "^[A-Za-z0-9][A-Za-z0-9._-]{0,127}\\.parquet$",
      "not": {
        "enum": [
          ".",
          ".."
        ]
      }
    },
    "data_checksum_sha256": {
      "type": "string",
      "pattern": "^[0-9a-f]{64}$"
    },
    "columns": {
      "type": "array",
      "minItems": 6,
      "items": {
        "type": "string"
      }
    },
    "dtypes": {
      "type": "object",
      "additionalProperties": {
        "type": "string"
      }
    },
    "row_count": {
      "type": "integer",
      "minimum": 0
    },
    "key_uniqueness": {
      "const": "instrument"
    },
    "logical_fingerprint": {
      "type": "string",
      "pattern": "^[0-9a-f]{64}$"
    },
    "serialization_profile_id": {
      "const": "parquet-v1"
    },
    "target_weights_binding": {
      "type": "object",
      "additionalProperties": false,
      "required": [
        "family",
        "generation_id",
        "manifest_digest_sha256"
      ],
      "properties": {
        "family": {
          "type": "string",
          "pattern": "^[a-z][a-z0-9_]{2,63}$"
        },
        "generation_id": {
          "type": "string",
          "pattern": "^[0-9a-f]{64}$"
        },
        "manifest_digest_sha256": {
          "type": "string",
          "pattern": "^[0-9a-f]{64}$"
        }
      }
    },
    "previous_state_binding": {
      "anyOf": [
        {
          "type": "object",
          "additionalProperties": false,
          "required": [
            "family",
            "generation_id",
            "manifest_digest_sha256"
          ],
          "properties": {
            "family": {
              "type": "string",
              "pattern": "^[a-z][a-z0-9_]{2,63}$"
            },
            "generation_id": {
              "type": "string",
              "pattern": "^[0-9a-f]{64}$"
            },
            "manifest_digest_sha256": {
              "type": "string",
              "pattern": "^[0-9a-f]{64}$"
            }
          }
        },
        {
          "type": "null"
        }
      ]
    },
    "execution_result_binding": {
      "type": "object",
      "additionalProperties": false,
      "required": [
        "family",
        "generation_id",
        "manifest_digest_sha256"
      ],
      "properties": {
        "family": {
          "type": "string",
          "pattern": "^[a-z][a-z0-9_]{2,63}$"
        },
        "generation_id": {
          "type": "string",
          "pattern": "^[0-9a-f]{64}$"
        },
        "manifest_digest_sha256": {
          "type": "string",
          "pattern": "^[0-9a-f]{64}$"
        }
      }
    },
    "risk_decision_binding": {
      "type": "object",
      "additionalProperties": false,
      "required": [
        "family",
        "generation_id",
        "manifest_digest_sha256"
      ],
      "properties": {
        "family": {
          "type": "string",
          "pattern": "^[a-z][a-z0-9_]{2,63}$"
        },
        "generation_id": {
          "type": "string",
          "pattern": "^[0-9a-f]{64}$"
        },
        "manifest_digest_sha256": {
          "type": "string",
          "pattern": "^[0-9a-f]{64}$"
        }
      }
    },
    "market_data_binding": {
      "type": "object",
      "additionalProperties": false,
      "required": [
        "family",
        "generation_id",
        "manifest_digest_sha256"
      ],
      "properties": {
        "family": {
          "type": "string",
          "pattern": "^[a-z][a-z0-9_]{2,63}$"
        },
        "generation_id": {
          "type": "string",
          "pattern": "^[0-9a-f]{64}$"
        },
        "manifest_digest_sha256": {
          "type": "string",
          "pattern": "^[0-9a-f]{64}$"
        }
      }
    },
    "run_id": {
      "type": "string",
      "format": "uuid"
    },
    "created_at": {
      "type": "string",
      "format": "date-time"
    },
    "quality_report_checksum_sha256": {
      "type": "string",
      "pattern": "^[0-9a-f]{64}$"
    },
    "manifest_digest_sha256": {
      "type": "string",
      "pattern": "^[0-9a-f]{64}$"
    },
    "generation_id": {
      "type": "string",
      "pattern": "^[0-9a-f]{64}$"
    }
  },
  "$defs": {
    "sha256": {
      "type": "string",
      "pattern": "^[0-9a-f]{64}$"
    },
    "uuid": {
      "type": "string",
      "format": "uuid"
    },
    "date": {
      "type": "string",
      "pattern": "^\\d{4}-\\d{2}-\\d{2}$"
    },
    "date_time": {
      "type": "string",
      "format": "date-time"
    },
    "path_segment": {
      "type": "string",
      "pattern": "^[A-Za-z0-9][A-Za-z0-9._-]{0,127}$",
      "not": {
        "enum": [
          ".",
          ".."
        ]
      }
    },
    "binding": {
      "type": "object",
      "additionalProperties": false,
      "required": [
        "family",
        "generation_id",
        "manifest_digest_sha256"
      ],
      "properties": {
        "family": {
          "type": "string",
          "pattern": "^[a-z][a-z0-9_]{2,63}$"
        },
        "generation_id": {
          "type": "string",
          "pattern": "^[0-9a-f]{64}$"
        },
        "manifest_digest_sha256": {
          "type": "string",
          "pattern": "^[0-9a-f]{64}$"
        }
      }
    },
    "producer": {
      "type": "object",
      "additionalProperties": false,
      "required": [
        "producer_code_fingerprint",
        "run_id",
        "created_at"
      ],
      "properties": {
        "producer_code_fingerprint": {
          "type": "string",
          "pattern": "^[0-9a-f]{64}$"
        },
        "run_id": {
          "type": "string",
          "format": "uuid"
        },
        "created_at": {
          "type": "string",
          "format": "date-time"
        }
      }
    }
  },
  "allOf": [
    {
      "if": {
        "properties": {
          "state_mode": {
            "const": "continuation"
          }
        }
      },
      "then": {
        "properties": {
          "previous_state_binding": {
            "type": "object"
          },
          "execution_result_binding": {
            "type": "object"
          }
        },
        "required": [
          "previous_state_binding",
          "execution_result_binding"
        ]
      }
    },
    {
      "if": {
        "properties": {
          "state_mode": {
            "const": "initial"
          }
        }
      },
      "then": {
        "properties": {
          "previous_state_binding": {
            "type": "null"
          }
        },
        "required": [
          "previous_state_binding"
        ]
      }
    }
  ]
}
