{
  "contract_version": 1,
  "schema_version": "1.0.0",
  "execution_id": "paper-demo",
  "state_date": "2026-01-06",
  "state_mode": "continuation",
  "cash": 99000.25,
  "data_file": "data.parquet",
  "data_checksum_sha256": "1111111111111111111111111111111111111111111111111111111111111111",
  "columns": [
    "instrument",
    "quantity",
    "average_cost",
    "buy_locked_quantity",
    "sellable_quantity",
    "market_value"
  ],
  "dtypes": {
    "instrument": "string",
    "quantity": "int64",
    "average_cost": "float64",
    "buy_locked_quantity": "int64",
    "sellable_quantity": "int64",
    "market_value": "float64"
  },
  "row_count": 1,
  "key_uniqueness": "instrument",
  "logical_fingerprint": "2222222222222222222222222222222222222222222222222222222222222222",
  "serialization_profile_id": "parquet-v1",
  "target_weights_binding": {
    "family": "target_weights_v1",
    "generation_id": "1111111111111111111111111111111111111111111111111111111111111111",
    "manifest_digest_sha256": "2222222222222222222222222222222222222222222222222222222222222222"
  },
  "previous_state_binding": {
    "family": "paper_portfolio_state_v1",
    "generation_id": "1111111111111111111111111111111111111111111111111111111111111111",
    "manifest_digest_sha256": "2222222222222222222222222222222222222222222222222222222222222222"
  },
  "execution_result_binding": {
    "family": "execution_result_v1",
    "generation_id": "ffffffffffffffffffffffffffffffffffffffffffffffffffffffffffffffff",
    "manifest_digest_sha256": "1111111111111111111111111111111111111111111111111111111111111111"
  },
  "risk_decision_binding": {
    "family": "risk_decision_v1",
    "generation_id": "ed905872027c3f79fb6d1cd60490f90865c6479676723ee105ed9da4d6957ac4",
    "manifest_digest_sha256": "4cb80c4d4c365ef8bc982676dfcb76c13938902c1ccadf0a5798f126a28daf80"
  },
  "market_data_binding": {
    "family": "bars_daily",
    "generation_id": "3333333333333333333333333333333333333333333333333333333333333333",
    "manifest_digest_sha256": "4444444444444444444444444444444444444444444444444444444444444444"
  },
  "run_id": "bf12fa86-43d0-5310-ba8e-6e28bf5bd727",
  "created_at": "2026-09-08T00:00:00+00:00",
  "quality_report_checksum_sha256": "eeeeeeeeeeeeeeeeeeeeeeeeeeeeeeeeeeeeeeeeeeeeeeeeeeeeeeeeeeeeeeee",
  "manifest_digest_sha256": "21cbad164dab1217d04af3753cc39392408d2f03a32fca48f913a075be68620a",
  "generation_id": "077e9e59259f302fffef8d401c0719c7d77c27986472b4b829fd12ca1d54de95"
}
